id,line_id,firm,org,neworg,finalorg,mission,category,issue,comments,amlawrank
259,662,Ropes & Gray,National Association for Criminal Defense Lawyers,,National Association for Criminal Defense Lawyers,The National Association of Criminal Defense Lawyers (NACDL) is the preeminent organization in the United States advancing the mission of the nation's criminal defense lawyers to ensure justice and due process for persons accused of crime or other miscond,3,Prisoner's Rights,,34
259,663,Ropes & Gray,Neighborhood Economic Development Advocacy Project (NEDAP),,Neighborhood Economic Development Advocacy Project (NEDAP),Mission <newline>NEDAP is a resource and advocacy center for community groups in New York City.  Our mission is to promote community economic justice and to eliminate discriminatory economic practices that harm communities and perpetuate inequality and po,3,Business/Economic Development,,34
259,666,Ropes & Gray,New York Lawyers for the Public Interest,,New York Lawyers for the Public Interest,OUR MISSION <newline>New York Lawyers for the Public Interest is a nonprofit civil rights law firm that strives for social justice. In partnership with member law firms corporate law departments and other organizations NYLPI helps underrepresented peop,2,Legal Services,,34
259,667,Ropes & Gray,Political Asylum/Immigration Representation Project (PAIR),,Political Asylum/Immigration Representation Project (PAIR),The Political Asylum/ Immigration Representation Project (PAIR) is a nationally recognized model that works to secure safety and freedom for asylum-seekers who have fled from persecution throughout the world and to promote the rights of immigrants unjustl,3,Immigration,,34
259,661,Ropes & Gray,U.S. Court of Appeals for the D.C. Circuit,,U.S. Court of Appeals for the D.C. Circuit,Ropes & Gray has represented a number of criminal defendants in their appeals before the D.C. Circuit Court of Appeals. We are proud of our ongoing commitment to clients with so much at stake and are dedicated to ensuring the protections guaranteed under,3,Prisoner's Rights,,34
,,Saul Ewing,AARP Legal Counsel for the Elderly,,AARP Legal Counsel for the Elderly,For 35 years LCE has championed the dignity and rights of Washington D.C.'s elderly by providing free legal and social work services to those in need „ empowering defending and protecting vulnerable seniors.,3,Elder,,179
,,Saul Ewing,Community Legal Services of Philadelphia,,Community Legal Services of Philadelphia,The mission of Community Legal Services (CLS) of Philadelphiaæis to help low-income Philadelphia residents obtain equal access to justice by providing them with advice and representation in civil legal matters; advocating for their legal rights; and conducting community education about the legal issues that affect them.,2,Legal Services,,179
,,Saul Ewing,Consumer Bankruptcy Assistance Project,,Consumer Bankruptcy Assistance Project,Attorneys paralegals and law students volunteer through CBAP's Fresh Start Clinic to provide direct pro bono legal representation to the indigent seeking to obtain the protection of Bankruptcy Court.,3,Other,,179
,,Saul Ewing,Dauphin County Area Agency on the Aging,,Dauphin County Area Agency on the Aging,At the Dauphin County Area Agency on Aging we recognize the inherent dignity of older individuals and believe they are entitled to health honor and self-determination. We are committed to maximizing efficient use of resources to enhance the lives of all seniors residing in Dauphin County.,3,Elder,,179
,,Saul Ewing,Delaware Volunteer Legal Services,,Delaware Volunteer Legal Services,To provide quality pro bono legal services to indigent Delawareans with meritorious civil legal problems.,2,Legal Services,,179
,,Saul Ewing,Homeless Advocacy Project,,Homeless Advocacy Project, <newline>The Homeless Advocacy Project (HAP) exists to meet the legal and advocacy needs of homeless individuals and families in Philadelphia. With a legal staff of six and a corps of 300 volunteer lawyers paralegals and law students HAP engages in di,3,Housing/Homeless,,179
,,Saul Ewing,Maryland Volunteer Lawyers Service,,Maryland Volunteer Lawyers Service,MVLS provides free (and in some cases low cost) legal representation to Marylanders with limited income.  We also provide free legal help for community-based nonprofits that are working to strengthen low-income communities in Maryland. www.mvlslaw.org,2,Legal Services,,179
,,Saul Ewing,Mercer County Veterans Association,,Mercer County Veterans Association,"We were formed out of necessity in 1980 when many Vietnam Era Veterans didn't think their needs and concerns were being addressed by the Government and other established Veterans organizations. We looked for focus on Agent Orange PTSD education employment health and family issues as well as Prisoners of War and Missing in Action. We were formed on this premise as well as those issues addressed by the other veterans structures. We were incorporated in the Commonwealth of Pennsylvania under the ""Non-Profit Corporation Law of 1972"". The date was 6 June 1983.",3,Veteran,,179
,,Saul Ewing,Pennsylvania Bar Association Military Assistance Panel,,Pennsylvania Bar Association Military Assistance Panel,The Military and VeteransÍ Affairs Committee shall study and make recommendations provide educational programming and coordinate statewide efforts on legal matters affecting active reserve and National Guard military service members retirees veterans and their families.,3,Veteran,,179
,,Saul Ewing,Philadelphia Volunteers for the Indigent Program,,Philadelphia Volunteers for the Indigent Program,VIP promotes equal justice for the poor by providing civil legal services not otherwise available collaborating with other legal services organizations and promoting a culture of volunteerism by educating and exposing attorneys and law students to issues,2,Legal Services,,179
,,Schiff Hardin,1st Defense Legal Aid,,1st Defense Legal Aid,FDLAÍs mission and program are unique both nationally and in the Chicago community. FDLA provides a free reliable and experienced lawyer to individuals who are arrested in the city of Chicago. Through the program staff and volunteer attorneys are on call 24 hours a day to assist individuals who have been taken into police custody. The attorney helps the client understand and assert his rights access necessary medical care documents any allegations of police abuse and by virtue of his presence helps deter police misconduct. FDLA is the only source of free legal representation available to indigent Chicagoans in police custody. FDLA is also engaged in education outreach community organizing and system reform activities.,3,Prisoner's Rights,,118
,,Schiff Hardin,ACLU,,ACLU,The ACLU is our nation's guardian of liberty working daily in courts legislatures and communities to defend and preserve the individual rights and liberties that the Constitution and laws of the United States guarantee everyone in this country.http://ww,3,Civil Rights/Civil Liberties,,118
,,Schiff Hardin,Center for Disability & Elder Law,,Center for Disability & Elder Law,Founded in 1984 by the Young Lawyers Section of the Chicago Bar Association CDEL is a 501(c)(3) nonprofit organization dedicated to protecting and advancing the legal rights of low-income persons with disabilities and senior citizens in Cook County.,3,Health/Disability,,118
,,Schiff Hardin,Chicago Lawyers Committee for Civil Rights,,Chicago Lawyers Committee for Civil Rights,The Chicago Lawyers' Committee maintains a focus in a broad range of civil rights and economic justice matters including: hate crime prevention and response; employment discrimination litigation; affordable housing development efforts fair housing complaints and fair mortgage-lending advocacy and litigation; and support for a broad range of economic development activity in Chicago including free legal services to individuals using small businesses/micro-enterprises as strategies to achieve self-sufficiency. ,3,Civil Rights/Civil Liberties,,118
,,Schiff Hardin,Chicago Volunteer Legal Services,,Chicago Volunteer Legal Services,Chicago Volunteer Legal Services Foundation was formed to coordinate promote and support the involvement of the legal community in the voluntary pro bono representation of individual clients from the ranks of Chicago area's poor and working poor.  Our vo,2,Legal Services,,118
,,Schiff Hardin,Community Economic Development Law Project,,Community Economic Development Law Project,The Community Economic Development Law Project was launched in 1985 to respond to an unmet need in the delivery of legal services. The rationale was simple: initiatives undertaken by low-income communities require the same legal expertise including tax ,3,Business/Economic Development,,118
,,Schiff Hardin,Illinois State Appellate Defender,,Illinois State Appellate Defender,The agencyÍs mission is providing high quality representation to our indigent clients.,2,Legal Services,,118
,,Schiff Hardin,Midwest Immigration and Human Rights Center,,Midwest Immigration and Human Rights Center,Our Mission <newline>The Midwest Coalition for Human Rights is a network of 48 advocacy organizations service providers and university-based human rights centers collaborating to promote and protect human rights in our Midwest region in the U.S. and i,3,Immigration,,118
,,Schiff Hardin,Trial Lawyers Care,,Trial Lawyers Care,Trial Lawyers Care (TLC) the charitable non-profit ATLA established to help victims of the September 11 terrorist attacks has established The Hurricane Katrina Relief Fund as a vehicle for collecting and distributing aid to relief organizations in Louisiana Mississippi and Alabama. Our goal is to get the most help where it's most needed most quickly.,3,Other,,118
,,Schiff Hardin,Uptown People's Law Center,,Uptown People's Law Center,The Uptown PeopleÍs Law Center represents poor and working people living in Uptown and other similar communities. The Law CenterÍs biggest areas of practice are landlord-tenant Social Security disability and public benefits. In addition the Law Center represents prisoners seeking to challenge the way they are treated in prison.,2,Legal Services,,118
267,668,Schulte Roth,Appleseed Foundation,,Appleseed Foundation,A non-profit network of 16 public interest justice centers in the U.S. and Mexico Appleseed is dedicated to building a society where opportunities are genuine access to the law is universal and equal and government advances the public interest. Applese,3,Other,,67
267,669,Schulte Roth,Asian American Legal Defense and Education Fund,,Asian American Legal Defense and Education Fund,Founded in 1974 the Asian American Legal Defense and Education Fund (AALDEF) is a national organization that protects and promotes the civil rights of Asian Americans. By combining litigation advocacy education and organizing AALDEF works with Asian ,3,Civil Rights/Civil Liberties,,67
267,670,Schulte Roth,Brennan Center for Justice,,Brennan Center for Justice,The Brennan Center for Justice at New York University School of Law is a non-partisan public policy and law institute that focuses on fundamental issues of democracy and justice. Our work ranges from voting rights to redistricting reform from access to t,3,Civil Rights/Civil Liberties,,67
267,671,Schulte Roth,Gay Men's Health Crisis,,Gay Men's Health Crisis,Mission Statement <newline>Gay Men's Health Crisis (GMHC) is a not-for-profit volunteer-supported and community-based organization committed to national leadership in the fight against AIDS. We provide prevention and care services to more than 15000 men,3,LGBT,,67
267,672,Schulte Roth,Human Rights First,,Human Rights First,Our Mission <newline>Human Rights First believes that building respect for human rights and the rule of law will help ensure the dignity to which every individual is entitled and will stem tyranny extremism intolerance and violence. <newline>Human Righ,3,Human Rights/International,,67
267,676,Schulte Roth,Lawyers Alliance for New York,,Lawyers Alliance for New York, <newline>Mission <newline>Lawyers Alliance for New York is the leading provider of business and transactional legal services for nonprofit organizations that are improving the quality of life in New York City neighborhoods. Our network of pro bono lawyer,3,Nonprofits,,67
267,673,Schulte Roth,Lawyers Committee for Civil Rights Under Law,,Lawyers Committee for Civil Rights Under Law,The Lawyers' Committee for Civil Rights Under Law a nonpartisan nonprofit organization was formed in 1963 at the request of President John F. Kennedy to involve the private bar in providing legal services to address racial discrimination. The principal,3,Civil Rights/Civil Liberties,,67
267,674,Schulte Roth,Neighborhood Housing Service,,Neighborhood Housing Service,NHS of NYC revitalizes underserved neighborhoods by creating and preserving affordable housing and providing opportunities for homeownership education financial assistance and community leadership. Working in partnership with government and business we ,3,Housing/Homeless,,67
267,675,Schulte Roth,New York Lawyers for the Public Interest,,New York Lawyers for the Public Interest,OUR MISSION <newline>New York Lawyers for the Public Interest is a nonprofit civil rights law firm that strives for social justice. In partnership with member law firms corporate law departments and other organizations NYLPI helps underrepresented peop,2,Legal Services,,67
267,677,Schulte Roth,Sanctuary for Families,,Sanctuary for Families,Sanctuary for Families envisions a society in which freedom from domestic violence is a basic human right. We are dedicated to the safety healing and self-sufficiency of battered women and their children. To that end we offer a broad range of high qual,3,Women's Rights,,67
,,Sedgwick Detert Moran and Arnold,Advocates for Children,,Advocates for Children,For over 35 years Advocates for Children of New York Inc. (AFC) has worked in partnership with New York City's most impoverished and vulnerable families to secure quality and equal public education services. AFC works on behalf of children from infancy t,3,Children,,135
,,Sedgwick Detert Moran and Arnold,CASA (Court Appointed Special Advocates),,CASA (Court Appointed Special Advocates),The mission of the SFCASA Program is to train community volunteers to serve as officers of the court to advocate for the best interests of abused and neglected children in the foster care system.,3,Children,,135
,,Sedgwick Detert Moran and Arnold,Children's Special Education Advocacy Project,,Children's Special Education Advocacy Project,The mission of The Children's Advocacy Project (CAP) is to help bridge the gap between the many quality social service agencies in the Kansas City area and the families that need their help the most. To bridge this gap we aim to empower and to inform those that care for the children of Kansas City through this web site. The CAP will assist families health care professionals and social service providers by furnishing the tools necessary to connect families in need to the appropriate social service agencies that serve them.,3,Children,,135
,,Sedgwick Detert Moran and Arnold,Legal Services for Children,,Legal Services for Children,Legal Services for Children (LSC) was founded in 1975 as one of the first non-profit law firms in the country to provide free legal representation and social work services to children and youth. <newline>LSC's mission is to ensure that all children and yo,3,Children,,135
,,Sedgwick Detert Moran and Arnold,Los Angeles Lawyers for Animals,,Los Angeles Lawyers for Animals,Can't find ,3,Animals,,135
,,Sedgwick Detert Moran and Arnold,Northern District of California's Pro Se Prisoner Litigation Project,,Northern District of California's Pro Se Prisoner Litigation Project,,3,Prisoner's Rights,,135
,,Sedgwick Detert Moran and Arnold,Public Counsel Law Center of California,Public Counsel,Public Counsel,Founded in 1970 Public Counsel strives to achieve three main goals: protecting the legal rights of disadvantaged children; representing immigrants who have been the victims of torture persecution domestic violence trafficking and other crimes; and fostering economic justice by providing individuals and institutions in underserved communities with access to quality legal representation.,2,Legal Services,,135
,,Sedgwick Detert Moran and Arnold,The Children's Justice Project,,The Children's Justice Project,The Children's Justice Project (CJP) was founded in the spring of 2002 by three law students Sarah Helvey Hannah Renfro and Notesong Srisopark Thompson.æ Their mission was to promote justice for children through interdisciplinary teaching scholarship and service. æSarah Hannah and Notesong established CJP as a dynamic student organization that contributed to the law student community by hosting speakers sending students to national conferences and establishing a successful fellowship program for students doing legal work on behalf of children. æSince its founding CJP has grown stronger every year.ææ,3,Children,,135
,,Sedgwick Detert Moran and Arnold,The Public Law Center,Public Law Center,Public Law Center,The Public Law Center (PLC) Orange County's pro bono law firm is committed to providing access to justice for low income residents. Through volunteers and staff PLC provides free civil legal services including counseling individual representation community education and strategic litigation and advocacy to challenge societal injustices.,2,Legal Services,,135
,,Sedgwick Detert Moran and Arnold,Volunteer Legal Services Foundation,Chicago Volunteer Legal Services,Chicago Volunteer Legal Services,To coordinate promote and support the involvement of the legal community in the voluntary pro bono representation of individual clients from the ranks of the Chicago areaÍs poor and working poor. To serve the working poor one client at a time.,2,Legal Services,,135
271,681,Shearman & Sterling,Human Rights First,,Human Rights First,Our Mission <newline>Human Rights First believes that building respect for human rights and the rule of law will help ensure the dignity to which every individual is entitled and will stem tyranny extremism intolerance and violence. <newline>Human Righ,3,Human Rights/International,,13
271,679,Shearman & Sterling,inMotion,,inMotion,Lasting legal solutions for families in domestic crisis <newline>InMotion provides free legal and social services to low-income women in New York City. Our services are designed to address the unique needs of women who suffer from abuse‰ÛÓmost of our clie,3,Women's Rights,,13
271,680,Shearman & Sterling,Lawyers Committee for Civil Rights Under Law,,Lawyers Committee for Civil Rights Under Law,The Lawyers' Committee for Civil Rights Under Law a nonpartisan nonprofit organization was formed in 1963 at the request of President John F. Kennedy to involve the private bar in providing legal services to address racial discrimination. The principal,3,Civil Rights/Civil Liberties,,13
271,678,Shearman & Sterling,Lawyers without Borders,,Lawyers without Borders,Lawyers Without Borders is the world's largest group of volunteer lawyers from around the globe who stand ready to offer pro bono service to international projects and initiatives. <newline>Our goal is to provide legal support to Rule of Law projects and ,3,Human Rights/International,,13
271,682,Shearman & Sterling,Legal Aid Society,,Legal Aid Society,Mission of The Legal Aid Society <newline>The Legal Aid Society is the nation's oldest and largest provider of legal services to the indigent. Founded in 1876 the Society provides a full range of civil legal services as well as criminal defense work and,2,Legal Services,,13
271,683,Shearman & Sterling,New York Lawyers for the Public Interest,,New York Lawyers for the Public Interest,OUR MISSION <newline>New York Lawyers for the Public Interest is a nonprofit civil rights law firm that strives for social justice. In partnership with member law firms corporate law departments and other organizations NYLPI helps underrepresented peop,2,Legal Services,,13
271,684,Shearman & Sterling,Robin Hood Foundation,,Robin Hood Foundation,Since 1988 Robin Hood has targeted poverty in New York City. By applying sound investment principles to philanthropy we've helped the best programs save lives and change fates. <newline> http://www.robinhood.org/approach.aspx <newline>,3,Nonprofits,,13
271,685,Shearman & Sterling,Sanctuary for Families,,Sanctuary for Families,Sanctuary for Families envisions a society in which freedom from domestic violence is a basic human right. We are dedicated to the safety healing and self-sufficiency of battered women and their children. To that end we offer a broad range of high qual,3,Women's Rights,,13
271,686,Shearman & Sterling,Volunteer Lawyers for the Arts,,Volunteer Lawyers for the Arts,Our Mission <newline>Since 1969 Volunteer Lawyers for the Arts has been the leading provider of pro bono legal services mediation services educational programs and publications and advocacy to the arts community in the New York area. Through public ad,1,Culture,,13
272,696,Sheppard Mullin,Bet Tzedek,,Bet Tzedek,Bet Tzedek The House of Justice provides free legal assistance to thousands of people who would otherwise be denied access to the legal system underpinning our democracy. http://www.bettzedek.org/mission.html,2,Legal Services,,77
272,697,Sheppard Mullin,Children's Law Center,,Children's Law Center,The Children's Law Center (CLC) envisions a future for the District of Columbia in which every child has a safe home a meaningful education and a healthy mind and body. We work towards this vision by providing legal services to at-risk children and their,3,Children,,77
272,695,Sheppard Mullin,Lawyers Committee for Civil Rights of the San Francisco Bay Area,,Lawyers Committee for Civil Rights of the San Francisco Bay Area,OUR MISSION <newline>The Lawyers' Committee for Civil Rights champions the legal rights of people of color poor people immigrants and refugees with a special commitment to African-Americans.http://www.lccr.com/,3,Civil Rights/Civil Liberties,,77
272,692,Sheppard Mullin,Legal Aid Foundation of Los Angeles,,Legal Aid Foundation of Los Angeles,Mission <newline>The Legal Aid Foundation of Los Angeles (LAFLA) is the frontline law firm for low-income people in Los Angeles. LAFLA is committed to promoting access to justice strengthening communities fighting discrimination and effecting systemic ,2,Legal Services,,77
272,688,Sheppard Mullin,Legal Aid Society of San Diego,,Legal Aid Society of San Diego,Mission of The Legal Aid Society <newline>The Legal Aid Society is the nation's oldest and largest provider of legal services to the indigent. Founded in 1876 the Society provides a full range of civil legal services as well as criminal defense work and,2,Legal Services,,77
272,690,Sheppard Mullin,Mama's Kitchen (AIDS/HIV organization),,Mama's Kitchen (AIDS/HIV organization),Our Mission <newline>At Mama's Kitchen we believe that every person is entitled to the basic necessity of life - nutritious food. As a volunteer-driven not-for-profit organization we prepare and deliver food to men women and children who are affected b,3,Health/Disability,,77
272,691,Sheppard Mullin,Project Concern International,,Project Concern International,Project Concern International is a non-profit health and humanitarian aid organization dedicated to preventing disease improving community health and promoting sustainable development. In places where access to health care is severely limited the best ,3,Health/Disability,,77
272,693,Sheppard Mullin,Public Counsel,,Public Counsel,Public Counsel is dedicated to advancing equal justice under law by delivering pro bono legal services to indigent and underrepresented children and adults throughout Los Angeles County ensuring that other community-based organizations serving this popul,2,Legal Services,,77
272,694,Sheppard Mullin,Public Law Center,,Public Law Center,The Public Law Center (PLC) Orange County's pro bono law firm is committed to providing access to justice for low income residents. Through volunteers and staff PLC provides free civil legal services including counseling individual representation co,2,Legal Services,,77
272,689,Sheppard Mullin,San Diego Volunteer Lawyer Program,,San Diego Volunteer Lawyer Program,To provide equal access to the justice system by serving as a bridge between indigent and other disadvantaged people in San Diego County and the volunteer lawyers and others who are willing to donate their time and resources.http://sdvlp.org/,2,Legal Services,,77
274,698,Sidley Austin,ACLU,,ACLU,The ACLU is our nation's guardian of liberty working daily in courts legislatures and communities to defend and preserve the individual rights and liberties that the Constitution and laws of the United States guarantee everyone in this country.http://ww,3,Civil Rights/Civil Liberties,,5
274,706,Sidley Austin,Alliance for Children's Rights,,Alliance for Children's Rights,The Alliance for Children's Rights is protecting the rights and futures of abused and impoverished children throughout Los Angeles County in hopes of creating a world in which all children are able to have a safe and permanent family access to quality h,3,Children,,5
274,699,Sidley Austin,CARPLS (Coordinated Advice and Referral Program for Legal Services),,CARPLS (Coordinated Advice and Referral Program for Legal Services),CARPLS is an innovative legal aid service that offers an immediate response to the every day legal problems confronting low-income residents of Cook County. CARPLS' Legal Aid Hotline and court-based Advice Desks give low-income clients direct access to ex,2,Legal Services,,5
