id,line_id,firm,org,neworg,finalorg,mission,category,issue,comments,amlawrank
83,177,Dewey Ballantine,Center on Addiction and Substance Abuse at Columbia University,,Center on Addiction and Substance Abuse at Columbia University,Mission Statement <newline>    * Inform Americans of the economic and social costs of substance abuse and its impact on their lives. <newline>    * Assess what works in prevention treatment and law enforcement. <newline>    * Encourage every individual ,3,Health/Disability,,58
83,178,Dewey Ballantine,Korean American Family Service Center,,Korean American Family Service Center,The Korean American Family Service Center (KAFSC) serves families in the New York metro area with programs to prevent and end violence in the home and in partner relationships. We provide counseling advocacy and education and programs to strengthen comm,3,Civil Rights/Civil Liberties,,58
83,180,Dewey Ballantine,Lawyers Alliance for New York,,Lawyers Alliance for New York, <newline>Mission <newline>Lawyers Alliance for New York is the leading provider of business and transactional legal services for nonprofit organizations that are improving the quality of life in New York City neighborhoods. Our network of pro bono lawyer,3,Nonprofits,,58
83,174,Dewey Ballantine,Legal Aid Society,,Legal Aid Society,Mission of The Legal Aid Society <newline>The Legal Aid Society is the nation's oldest and largest provider of legal services to the indigent. Founded in 1876 the Society provides a full range of civil legal services as well as criminal defense work and,2,Legal Services,,58
83,179,Dewey Ballantine,New York Lawyers for the Public Interest,,New York Lawyers for the Public Interest,OUR MISSION <newline>New York Lawyers for the Public Interest is a nonprofit civil rights law firm that strives for social justice. In partnership with member law firms corporate law departments and other organizations NYLPI helps underrepresented peop,2,Legal Services,,58
83,182.2,Dewey Ballantine,Office of the Appellate Defender,,Office of the Appellate Defender,The Office of the State Appellate Defender is a state agency created by the State Appellate Defender Act (725 Illinois Compiled Statutes Act 105). The principal function of the Office of the State Appellate Defender is to represent indigent persons on ap,3,Prisoner's Rights,,58
83,175,Dewey Ballantine,Welfare Law Center,,Welfare Law Center,The National Center for Law and Economic Justice's vision is a society in which low-income individuals and families have the support they need to maintain a decent standard of living and take full advantage of opportunities to better their lives. <newline,3,Poverty,,58
87,187,Dickstein Shapiro,AARP Legal Counsel for the Elderly,,AARP Legal Counsel for the Elderly,For more than 50 years AARP has been serving its members and creating positive social change. <newline>AARP's mission is to enhance the quality of life for all as we age leading positive social change and delivering value to members through information,3,Elder,,
87,185,Dickstein Shapiro,ACLU,,ACLU,The ACLU is our nation's guardian of liberty working daily in courts legislatures and communities to defend and preserve the individual rights and liberties that the Constitution and laws of the United States guarantee everyone in this country.http://ww,3,Civil Rights/Civil Liberties,,
87,189,Dickstein Shapiro,Bread for the City,,Bread for the City,The mission of Bread for the City is to provide vulnerable residents of Washington DC with comprehensive services including food clothing medical care and legal and social services in an atmosphere of dignity and respect. We recognize that all peop,2,Legal Services,,
87,191,Dickstein Shapiro,Children's Law Center,,Children's Law Center,The Children's Law Center (CLC) envisions a future for the District of Columbia in which every child has a safe home a meaningful education and a healthy mind and body. We work towards this vision by providing legal services to at-risk children and their,3,Children,,
87,183,Dickstein Shapiro,D.C. Bar Pro Bono Clinic,D.C. Bar,D.C. Bar,Our Mission <newline>The D.C. Bar Pro Bono Program strives to mobilize the private bar to assist in making legal advice and representation fully available to low‰ÛÒincome persons in the District of Columbia. <newline>Program activities include: <newline> ,2,Legal Services,,
87,190,Dickstein Shapiro,Lawyers Committee for Civil Rights Under Law,,Lawyers Committee for Civil Rights Under Law,The Lawyers' Committee for Civil Rights Under Law a nonpartisan nonprofit organization was formed in 1963 at the request of President John F. Kennedy to involve the private bar in providing legal services to address racial discrimination. The principal,3,Civil Rights/Civil Liberties,,
87,192,Dickstein Shapiro,Lawyers for Children America,,Lawyers for Children America, <newline>Our Mission - Lawyers for Children America is a lead child advocacy organization protecting the rights of children who are victims of abuse; abandonment and neglect by providing quality pro bono legal representation and collaborating for systema,3,Children,,
87,184,Dickstein Shapiro,NAACP,,NAACP,Our Mission <newline>The mission of the National Association for the Advancement of Colored People is to ensure the political educational social and economic equality of rights of all persons and to eliminate racial hatred and racial discrimination. <n,3,Civil Rights/Civil Liberties,,
87,186,Dickstein Shapiro,Trial Lawyers Care,,Trial Lawyers Care,Trial Lawyers Care (TLC) the charitable non-profit ATLA established to help victims of the September 11 terrorist attacks has established The Hurricane Katrina Relief Fund as a vehicle for collecting and distributing aid to relief organizations in Louis,3,Other,,
87,188,Dickstein Shapiro,Washington Area Lawyers For the Arts,,Washington Area Lawyers For the Arts,Since 1983 Washington Area Lawyers for the Arts has supported artistic expression and creative innovation by serving the legal needs of Washington Maryland and Virginia's arts and cultural communities. <newline>A 501 (c) 3 not-for profit organization W,1,Culture,,
89,193,DLA Piper,Asian American Legal Services Clinic,,Asian American Legal Services Clinic,The pro-bono Asian American Legal Services Clinic (AALSC) is made possible through the partnership of AHS DLA Piper US LLP (DLA Piper) and Chicago Volunteer Legal Services Foundation (CVLS). The clinic aims to meet the legal needs of the community by pr,2,Legal Services,not ethnicity,10
89,194,DLA Piper,Bay Area Legal Services,,Bay Area Legal Services,We are a family of 49 lawyers and a support staff of 55 all who have dedicated themselves to providing free civil legal services for low-income families throughout the Bay Area.  We are committed to what we do because we are passionate about certain cor,2,Legal Services,,10
89,195,DLA Piper,Children's Law Center,,Children's Law Center,The Children's Law Center (CLC) envisions a future for the District of Columbia in which every child has a safe home a meaningful education and a healthy mind and body. We work towards this vision by providing legal services to at-risk children and their,3,Children,,10
89,196,DLA Piper,Community Economic Development Law Project,,Community Economic Development Law Project,The Community Economic Development Law Project was launched in 1985 to respond to an unmet need in the delivery of legal services. The rationale was simple: initiatives undertaken by low-income communities require the same legal expertise including tax ,3,Business/Economic Development,,10
89,197,DLA Piper,Community Legal Services in East Palo Alto,,Community Legal Services in East Palo Alto,http://www.clsepa.org/,2,Legal Services,,10
89,198,DLA Piper,D.C. Bar Pro Bono Clinic,D.C. Bar,D.C. Bar,Our Mission <newline>The D.C. Bar Pro Bono Program strives to mobilize the private bar to assist in making legal advice and representation fully available to low‰ÛÒincome persons in the District of Columbia. <newline>Program activities include: <newline> ,2,Legal Services,,10
89,200,DLA Piper,Maryland Volunteer Lawyers Service,,Maryland Volunteer Lawyers Service,MVLS provides free (and in some cases low cost) legal representation to Marylanders with limited income.  We also provide free legal help for community-based nonprofits that are working to strengthen low-income communities in Maryland. www.mvlslaw.org,2,Legal Services,,10
89,199,DLA Piper,Public International Law & Policy Group,,Public International Law & Policy Group,The Public International Law & Policy Group (PILPG) a 2005 Nobel Peace Prize nominee is a 501(c)(3) non-profit organization which operates as a global pro bono law firm providing free legal assistance to states and governments involved in conflicts. To,3,Human Rights/International,,10
89,201,DLA Piper,San Diego Volunteer Lawyer Program,,San Diego Volunteer Lawyer Program,To provide equal access to the justice system by serving as a bridge between indigent and other disadvantaged people in San Diego County and the volunteer lawyers and others who are willing to donate their time and resources.http://sdvlp.org/,2,Legal Services,,10
89,202,DLA Piper,Stanford Community Law Clinic,,Stanford Community Law Clinic,The Stanford Community Law Clinic is a direct-services clinic serving low-income people in and around East Palo Alto an economically challenged community four miles from the law school campus. With an emphasis on trial-level skills‰ÛÓincluding fact inves,2,Legal Services,,10
90,205,Dorsey & Whitney,ABA Commission on Immigration,ABA,ABA,1) advocates for statutory and regulatory modifications in law and governmental practice consistent with ABA policy; 2) provides continuing education and timely information about trends court decisions and pertinent developments for members of the legal ,3,Immigration,,68
90,206,Dorsey & Whitney,ACLU,,ACLU,The ACLU is our nation's guardian of liberty working daily in courts legislatures and communities to defend and preserve the individual rights and liberties that the Constitution and laws of the United States guarantee everyone in this country.http://ww,3,Civil Rights/Civil Liberties,,68
90,209,Dorsey & Whitney,American Diabetes Association,,American Diabetes Association,he Association funds research to prevent cure and manage diabetes; delivers services to hundreds of communities; provides objective and credible information; and gives voice to those denied their rights because of diabetes. Founded in 1940 our mission i,3,Health/Disability,,68
90,211,Dorsey & Whitney,American Liver Foundation,,American Liver Foundation,Our mission is to facilitate advocate and promote education support and research for the prevention treatment and cure of liver disease. http://www.liverfoundation.org/about/,3,Health/Disability,,68
90,212,Dorsey & Whitney,Boys Choir of Harlem,,Boys Choir of Harlem,The Boys and Girls Choir of Harlem Alumni Ensemble's mission is to continue the legacy of Dr. Walter Turnbull and The Boys and Girls Choirs of Harlem by being an artistically driven organization dedicated to providing its members and its community in gene,1,Culture,,68
90,210,Dorsey & Whitney,Colorado Uplift,,Colorado Uplift,"Mission Statement: \ Building long-term life-changing relationships with urban youth.\""                                                         For over 25 years of operation UpLift has remained focused on its mission empowering urban youth to lead succ",3,Children,,68
90,207,Dorsey & Whitney,LAMBDA Legal Defense and Education Fund,,LAMBDA Legal Defense and Education Fund,Lambda Legal is a national organization committed to achieving full recognition of the civil rights of lesbians gay men bisexuals transgender people and those with HIV through impact litigation education and public policy work.http://www.lambdalegal.o,3,LGBT,,68
90,203,Dorsey & Whitney,Lawyers Committee for Civil Rights Under Law,,Lawyers Committee for Civil Rights Under Law,The Lawyers' Committee for Civil Rights Under Law a nonpartisan nonprofit organization was formed in 1963 at the request of President John F. Kennedy to involve the private bar in providing legal services to address racial discrimination. The principal,3,Civil Rights/Civil Liberties,,68
90,208,Dorsey & Whitney,Minnesota Advocates for Human Rights,,Minnesota Advocates for Human Rights, <newline>About The Advocates for Human Rights <newline>The Advocates has received international recognition for a broad range of innovative programs to promote human rights and prevent the violation of those rights. The Advocates provides investigative f,3,Human Rights/International,,68
90,204,Dorsey & Whitney,NAACP,,NAACP,Our Mission <newline>The mission of the National Association for the Advancement of Colored People is to ensure the political educational social and economic equality of rights of all persons and to eliminate racial hatred and racial discrimination. <n,3,Civil Rights/Civil Liberties,,68
92,215,Drinker Biddle,ACLU,,ACLU,The ACLU is our nation's guardian of liberty working daily in courts legislatures and communities to defend and preserve the individual rights and liberties that the Constitution and laws of the United States guarantee everyone in this country.http://ww,3,Civil Rights/Civil Liberties,,96
92,214,Drinker Biddle,Legal Clinic for the Disabled,,Legal Clinic for the Disabled,The Legal Clinic for the Disabled a 501(c)(3) non-profit corporation with offices at Magee Rehabilitation Hospital provides free legal services to low-income people with physical disabilities in Philadelphia Bucks Chester Delaware and Montgomery Coun,3,Health/Disability,,96
92,220,Drinker Biddle,Philadelphia Bar Association Military Assistance Project,,Philadelphia Bar Association Military Assistance Project,Through the Military Assistance Program volunteer attorneys provide free legal assistance regardless of the income of the service man or woman. Areas of law include SSCRA USERRA SGLI wills and estate planning debtor/creditor employment consumer h,3,Veteran,,96
92,217.1,Drinker Biddle,Philadelphia Volunteer Lawyers for the Arts,,Philadelphia Volunteer Lawyers for the Arts,The Arts & Business Council of Greater Philadelphia helps drive the cultural vitality and economic development of the Greater Philadelphia Region by strengthening the partnership between business and the arts and cultural community. <newline> http://www.a,1,Culture,,96
92,213,Drinker Biddle,Philadelphia Volunteers for the Indigent Program,,Philadelphia Volunteers for the Indigent Program,VIP promotes equal justice for the poor by providing civil legal services not otherwise available collaborating with other legal services organizations and promoting a culture of volunteerism by educating and exposing attorneys and law students to issues,2,Legal Services,,96
92,222,Drinker Biddle,Prisoner Civil Rights Panel of the U.S. District Court for the Eastern District of Pennsyvania,,Prisoner Civil Rights Panel of the U.S. District Court for the Eastern District of Pennsyvania, Prisoner Civil Rights Panel for the United States District Court for the Eastern District of Pennsylvania; the panel is responsible for coordinating and assigning court appointments in prisoner civil rights matters to lawyers and law firms that agree to ,3,Prisoner's Rights,,96
92,221,Drinker Biddle,Pro Bono Partnership,,Pro Bono Partnership,THE PRO BONO PARTNERSHIP is a tax-exempt public charity that provides free business legal services to eligible nonprofit community-based organizations in Westchester County NY Fairfield County CT; Hartford CT; and New Jersey. <newline>The Partnership ,3,Business/Economic Development,,96
92,219,Drinker Biddle,Senior Law Center,,Senior Law Center,For nearly three decades Community Legal Services Inc. (CLS) has provided the highest quality legal assistance to the needy with the ongoing support of the Philadelphia Bar Association and the legal community. Our mission is to help low-income Philadelp,3,Elder,,96
92,216,Drinker Biddle,Support Center for Child Advocates,,Support Center for Child Advocates,The Support Center for Child Advocates provides legal assistance and social service advocacy to abused and neglected children in Philadelphia County. Child Advocates is one of the most successful volunteer models serving children in the country. Since its,3,Children,,96
92,218,Drinker Biddle,Veterans Pro Bono Consortium,,Veterans Pro Bono Consortium,The Veterans Consortium Pro Bono Program (Program) was created in 1992 with a dual mission: to recruit and train attorneys in the fledgling field of veterans' law; and to provide assistance to unrepresented appellants at the U.S. Court of Appeals for Vet,3,Veteran,,96
92,217.2,Drinker Biddle,Washington Area Lawyers For the Arts,,Washington Area Lawyers For the Arts,Since 1983 Washington Area Lawyers for the Arts has supported artistic expression and creative innovation by serving the legal needs of Washington Maryland and Virginia's arts and cultural communities. <newline>A 501 (c) 3 not-for profit organization W,1,Culture,,96
,,Dykema Gossett,ACLU,,ACLU,The ACLU is our nation's guardian of liberty working daily in courts legislatures and communities to defend and preserve the individual rights and liberties that the Constitution and laws of the United States guarantee everyone in this country.http://ww,3,Civil Rights/Civil Liberties,,143
,,Dykema Gossett,Chicago Volunteer Legal Services,,Chicago Volunteer Legal Services,Chicago Volunteer Legal Services Foundation was formed to coordinate promote and support the involvement of the legal community in the voluntary pro bono representation of individual clients from the ranks of Chicago area's poor and working poor.  Our vo,2,Legal Services,,143
,,Dykema Gossett,Community Legal Resources Detroit MI,,Community Legal Resources Detroit MI,Community Legal Resources delivers free legal services to nonprofit organizations building neighborhoods in Detroit and throughout Michigan. Our mission is to foster pro bono legal representation for unfulfilled legal needs of nonprofit community organiza,2,Legal Services,,143
,,Dykema Gossett,Detroit Legal Services Clinic,,Detroit Legal Services Clinic,The Detroit Legal Services Clinic (DLSC) is a unique avenue for the provision of legal services to the indigent in the metropolitan Detroit area. It represents collaboration between the Detroit Metropolitan Bar Association corporate legal staffs the staffs of the major law firms in the area and several providers of legal services to the indigent. The Clinic is an attempt to put practitioners who normally do not have direct client contact into a one-on-one relationship with a qualifying individual.,2,Legal Services,,143
,,Dykema Gossett,First Step Domestic Violence Prevention,,First Step Domestic Violence Prevention,To promote safety to victims of violence through education counseling advocacy and shelter when needed to any person suffering the effects of domestic violence and/or sexual assault. To promote non-violent behavior by educating the perpetrators of violence.,3,Women's Rights,,143
,,Dykema Gossett,LA County Bar Association Barristers AIDS Legal Services Project,,LA County Bar Association Barristers AIDS Legal Services Project,The AIDS Legal Services Project (ALSP) has directed its resources to assisting low-income people living with HIV disease almost from the very beginning of the HIV epidemic. Since it was founded in 1986 by the LACBA Barristers the Project has provided direct one-on-one pro bono legal representation to thousands of people living with HIV and AIDS who have an HIV related legal problem. The scope of services includes immigration guardianships discrimination public and private benefits debtor relief and bankruptcy simple estate planning and housing.æ,3,Health/Disability,,143
,,Dykema Gossett,National Center for Missing and Exploited Children,,National Center for Missing and Exploited Children, National Mandate and Mission <newline>The National Center for Missing & Exploited Children'så¨ (NCMEC) mission is to help prevent child abduction and sexual exploitation; help find missing children; and assist victims of child abduction and sexual exploi,3,Children,,143
,,Dykema Gossett,Nature Conservancy,,Nature Conservancy,As indispensable to The Nature Conservancy's success as our unifying mission vision goals and measures are our unique values‰ÛÓthe distinguishing attributes that characterize how we conduct ourselves in our drive for tangible lasting results. These att,3,Environment,,143
97,223,Edwards Angell,Boston Bar Association Business Law Pro Bono Project,,Boston Bar Association Business Law Pro Bono Project,In fall of 2001 the Clearinghouse began administering the Boston Bar Association's Business Law Pro Bono Project (BLP). The project was designed to bring more pro bono opportunities to business and transactional attorneys. While many pro bono projects ta,3,Nonprofits,,
97,224,Edwards Angell,Economic Justice Project of the Lawyers Committee for Civil Rights Under Law,Lawyers Committee for Civil Rights Under Law,Lawyers Committee for Civil Rights Under Law,,3,Business/Economic Development,,
97,225,Edwards Angell,Greater Boston Legal Services,,Greater Boston Legal Services,Greater Boston Legal Services (GBLS) provides free civil (non-criminal) legal assistance to low-income people in Boston and thirty-one additional cities and towns. The help we offer ranges from legal advice to full case representation depending on client,2,Legal Services,,
97,226,Edwards Angell,Habitat for Humanity,,Habitat for Humanity,Habitat for Humanity Mission <newline>Habitat for Humanity works in partnership with God and people everywhere from all walks of life to develop communities with people in need by building and renovating houses so that there are decent houses in decent ,3,Housing/Homeless,,
97,227,Edwards Angell,Lawyers Clearinghouse on Affordable Housing and Homelessness,,Lawyers Clearinghouse on Affordable Housing and Homelessness, <newline>Our Mission <newline>To promote the development of affordable housing reduce homelessness and strengthen communities by providing pro bono legal services to nonprofit organizations and to individuals who are homeless or at risk of becoming hom,3,Housing/Homeless,,
97,228,Edwards Angell,Lawyers Committee for Civil Rights Under Law,,Lawyers Committee for Civil Rights Under Law,The Lawyers' Committee for Civil Rights Under Law a nonpartisan nonprofit organization was formed in 1963 at the request of President John F. Kennedy to involve the private bar in providing legal services to address racial discrimination. The principal,3,Civil Rights/Civil Liberties,,
97,229,Edwards Angell,Massachusetts Housing Partnership Fund's Soft Second Loan Program,,Massachusetts Housing Partnership Fund's Soft Second Loan Program,In 1992 the Cape Cod Commission was successful in establishing the Barnstable County Soft Second Loan Program (SSLP) an innovative homeownership program for first-time low and moderate buyers. The program expands the buying power of the purchaser by appr,3,Housing/Homeless,,
97,230,Edwards Angell,Trust for Public Land,,Trust for Public Land,About TPL <newline>The Trust for Public Land (TPL) is a national nonprofit land conservation organization that conserves land for people to enjoy as parks community gardens historic sites rural lands and other natural places ensuring livable commun,3,Environment,,
97,231,Edwards Angell,Volunteer Lawyers for the Arts,,Volunteer Lawyers for the Arts,Our Mission <newline>Since 1969 Volunteer Lawyers for the Arts has been the leading provider of pro bono legal services mediation services educational programs and publications and advocacy to the arts community in the New York area. Through public ad,1,Culture,,
97,232,Edwards Angell,Volunteer Lawyers Project in Boston,Boston Bar Association,Boston Bar Association, Our Mission <newline>The mission of the Volunteer Lawyers Project of the Boston Bar Association is: <newline>a) to provide high quality pro bono legal services in a broad range of civil matters to eligible residents of the greater Boston area including,2,Legal Services,,
100,239,Faegre & Benson,Colorado Lawyers Committee,,Colorado Lawyers Committee,Welcome to the Colorado Lawyers Committee. The Lawyers Committee is a 30 year-old nonprofit nonpartisan consortium of 50 Denver-area law firms that do high impact <newline>pro bono work and are dedicated to using ‰ÛÏall the skills and discipline of the l,2,Legal Services,,92
100,242,Faegre & Benson,Des Moines Public Library,,Des Moines Public Library, <newline>Mission Vision and Core Values <newline>Our Mission <newline>The Des Moines Public Library is the bridge to a world of information and <newline>ideas for personal enjoyment and community growth. <newline>Our Vision <newline>The Des Moines Publi,1,Culture,library,92
100,241,Faegre & Benson,Homestead Center for Adults with Autism,,Homestead Center for Adults with Autism, <newline>    Our Mission: <newline>    The Homestead develops innovative solutions for people with autism provides training and supports for people with autism and helps others understand autism and better solutions for people with autism through educat,3,Health/Disability,,92
100,240,Faegre & Benson,Innocence Project,,Innocence Project,Mission Statement <newline>The Innocence Project was founded in 1992 by Barry C. Scheck and Peter J. Neufeld at the Benjamin N. Cardozo School of Law at Yeshiva University to assist prisoners who could be proven innocent through DNA testing. To date 234 ,3,Prisoner's Rights,,92
